{"schema_version":"local-monitor-node-content.response.v2","workspace_revision":"18e629b48a679f3370b973894beb27bde10514fdd490fdde5b14f81533695f8d","session_id":"018f0000-0000-7000-8000-000000000001","node_id":"node-a8a773d6614d5030f505ff195b452dd6","part":"event_content","state":"available","source_reference":{"store_kind":"session_event_content","source_item_id":"018f0000-0000-7000-8000-000000000004","revision":1},"text":"A😀é\n","utf8_byte_length":8,"unicode_scalar_length":4,"truncation":false}